sentence,label,probable,improbable,impossible,inconceivable
Someone carried groceries inside a tote bag.,probable,0.9583333333333334,0.041666666666666664,0.0,0.0
Someone carved a statue using a sock.,impossible,0.0,0.13953488372093023,0.7906976744186046,0.06976744186046512
Someone carved a statue using a nail.,improbable,0.075,0.875,0.05,0.0
Someone carved a statue using laughter.,inconceivable,0.0,0.0,0.1875,0.8125
Someone carved a statue using a chisel.,probable,0.9705882352941176,0.029411764705882353,0.0,0.0
Someone caught a fish in a raindrop.,impossible,0.0,0.05405405405405406,0.6756756756756757,0.2702702702702703
Someone caught a fish in a puddle.,improbable,0.30612244897959184,0.5714285714285714,0.12244897959183673,0.0
Someone caught a fish in an exclamation.,inconceivable,0.0,0.0,0.08823529411764706,0.9117647058823529
Someone caught a fish in a lake.,probable,1.0,0.0,0.0,0.0
Someone chilled a drink using fire.,impossible,0.0,0.029411764705882353,0.9411764705882353,0.029411764705882353
Someone chilled a drink using snow.,improbable,0.36363636363636365,0.6136363636363636,0.0,0.022727272727272728
Someone chilled a drink using yesterday.,inconceivable,0.0,0.0,0.0,1.0
Someone chilled a drink using ice.,probable,1.0,0.0,0.0,0.0
